{
  "$schema": "https://json-schema.org/draft/2020-12/schema",
  "$id": "https://praypharn-beep.github.io/teacher-media/schema/library-item.schema.json",
  "title": "Library MediaItem",
  "type": "object",
  "additionalProperties": false,
  "properties": {
    "jobId": {
      "type": "string",
      "minLength": 1
    },
    "type": {
      "type": "string",
      "minLength": 1
    },
    "subject": {
      "type": "string",
      "minLength": 1
    },
    "grade": {
      "type": "string",
      "minLength": 1
    },
    "topic": {
      "type": "string",
      "minLength": 1
    },
    "url": {
      "type": "string",
      "format": "uri",
      "minLength": 1
    },
    "date": {
      "type": "string",
      "pattern": "^\\d{4}-\\d{2}-\\d{2}$"
    }
  },
  "required": [
    "jobId",
    "type",
    "subject",
    "grade",
    "topic",
    "url",
    "date"
  ]
}
