[
  {
    "jobId": "J1784395741990",
    "type": "เกม/สื่อ interactive",
    "subject": "วิทยาศาสตร์",
    "grade": "ป.3",
    "topic": "แรงและการเคลื่อนที่",
    "url": "https://praypharn-beep.github.io/teacher-media/games/J1784395741990.html",
    "date": "2026-07-22"
  },
  {
    "jobId": "J1784510094903",
    "type": "เกม/สื่อ interactive",
    "subject": "วิทยาศาสตร์",
    "grade": "ป.4",
    "topic": "ระบบสุริยะ",
    "url": "https://praypharn-beep.github.io/teacher-media/games/J1784510094903.html",
    "date": "2026-07-20"
  },
  {
    "jobId": "J1784395741990",
    "type": "เกม/สื่อ interactive",
    "subject": "วิทยาศาสตร์",
    "grade": "ป.3",
    "topic": "แรงและการเคลื่อนที่",
    "url": "https://praypharn-beep.github.io/teacher-media/games/J1784395741990.html",
    "date": "2026-07-20"
  },
  {
    "jobId": "J1784413532215",
    "type": "เกม/สื่อ interactive",
    "subject": "คณิตศาสตร์",
    "grade": "ป.3",
    "topic": "การหาร",
    "url": "https://praypharn-beep.github.io/teacher-media/games/J1784413532215.html",
    "date": "2026-07-20"
  },
  {
    "jobId": "J1784256147282",
    "type": "เกม/สื่อ interactive",
    "subject": "ภาษาไทย",
    "grade": "ป.3",
    "topic": "มาตราตัวสะกด (มังกรมาตรา)",
    "url": "https://praypharn-beep.github.io/teacher-media/games/J1784256147282.html",
    "date": "2026-07-17"
  },
  {
    "jobId": "J1784195701769",
    "type": "เกม/สื่อ interactive",
    "subject": "วิทยาศาสตร์",
    "grade": "ป.3",
    "topic": "การเกิดฝน (น้องหยด ช่วยโลกหมุนน้ำ)",
    "url": "https://praypharn-beep.github.io/teacher-media/games/J1784195701769.html",
    "date": "2026-07-17"
  }
]